[{"id":1,"name":"Master Warrior","category":"QUEST","patch":"1298","source":[{"kind":"SERVER_ENUM","ref":"Open-KO/KnightOnline@7d6cf81093e142c928c2ac9510512b2b182178b5:src/shared/globals.h"}],"confidence":"HIGH","notes":"Quest ID from OpenKO e_QuestId; NPC/event association is not asserted unless independently sourced."},{"id":2,"name":"Master Rogue","category":"QUEST","patch":"1298","source":[{"kind":"SERVER_ENUM","ref":"Open-KO/KnightOnline@7d6cf81093e142c928c2ac9510512b2b182178b5:src/shared/globals.h"}],"confidence":"HIGH","notes":"Quest ID from OpenKO e_QuestId; NPC/event association is not asserted unless independently sourced."},{"id":3,"name":"Master Mage","category":"QUEST","patch":"1298","source":[{"kind":"SERVER_ENUM","ref":"Open-KO/KnightOnline@7d6cf81093e142c928c2ac9510512b2b182178b5:src/shared/globals.h"}],"confidence":"HIGH","notes":"Quest ID from OpenKO e_QuestId; NPC/event association is not asserted unless independently sourced."},{"id":4,"name":"Master Priest","category":"QUEST","patch":"1298","source":[{"kind":"SERVER_ENUM","ref":"Open-KO/KnightOnline@7d6cf81093e142c928c2ac9510512b2b182178b5:src/shared/globals.h"}],"confidence":"HIGH","notes":"Quest ID from OpenKO e_QuestId; NPC/event association is not asserted unless independently sourced."},{"id":5,"name":"Proconsul's Request","category":"QUEST","patch":"1298","source":[{"kind":"SERVER_ENUM","ref":"Open-KO/KnightOnline@7d6cf81093e142c928c2ac9510512b2b182178b5:src/shared/globals.h"}],"confidence":"HIGH","notes":"Quest ID from OpenKO e_QuestId; NPC/event association is not asserted unless independently sourced."},{"id":6,"name":"Issac Recommendation","category":"QUEST","patch":"1298","source":[{"kind":"SERVER_ENUM","ref":"Open-KO/KnightOnline@7d6cf81093e142c928c2ac9510512b2b182178b5:src/shared/globals.h"}],"confidence":"HIGH","notes":"Quest ID from OpenKO e_QuestId; NPC/event association is not asserted unless independently sourced."},{"id":7,"name":"Gem of Bravery","category":"QUEST","patch":"1298","source":[{"kind":"SERVER_ENUM","ref":"Open-KO/KnightOnline@7d6cf81093e142c928c2ac9510512b2b182178b5:src/shared/globals.h"}],"confidence":"HIGH","notes":"Quest ID from OpenKO e_QuestId; NPC/event association is not asserted unless independently sourced."},{"id":8,"name":"Reconnaissance Report","category":"QUEST","patch":"1298","source":[{"kind":"SERVER_ENUM","ref":"Open-KO/KnightOnline@7d6cf81093e142c928c2ac9510512b2b182178b5:src/shared/globals.h"}],"confidence":"HIGH","notes":"Quest ID from OpenKO e_QuestId; NPC/event association is not asserted unless independently sourced."},{"id":9,"name":"Guardians of the 7 Keys","category":"QUEST","patch":"1298","source":[{"kind":"SERVER_ENUM","ref":"Open-KO/KnightOnline@7d6cf81093e142c928c2ac9510512b2b182178b5:src/shared/globals.h"}],"confidence":"HIGH","notes":"Quest ID from OpenKO e_QuestId; NPC/event association is not asserted unless independently sourced."},{"id":11,"name":"A Duel with the Ork","category":"QUEST","patch":"1298","source":[{"kind":"SERVER_ENUM","ref":"Open-KO/KnightOnline@7d6cf81093e142c928c2ac9510512b2b182178b5:src/shared/globals.h"}],"confidence":"HIGH","notes":"Quest ID from OpenKO e_QuestId; NPC/event association is not asserted unless independently sourced."},{"id":12,"name":"Fang of Wolf Man","category":"QUEST","patch":"1298","source":[{"kind":"SERVER_ENUM","ref":"Open-KO/KnightOnline@7d6cf81093e142c928c2ac9510512b2b182178b5:src/shared/globals.h"}],"confidence":"HIGH","notes":"Quest ID from OpenKO e_QuestId; NPC/event association is not asserted unless independently sourced."},{"id":13,"name":"Relic Searcher","category":"QUEST","patch":"1298","source":[{"kind":"SERVER_ENUM","ref":"Open-KO/KnightOnline@7d6cf81093e142c928c2ac9510512b2b182178b5:src/shared/globals.h"}],"confidence":"HIGH","notes":"Quest ID from OpenKO e_QuestId; NPC/event association is not asserted unless independently sourced."},{"id":14,"name":"Guard Trainee","category":"QUEST","patch":"1298","source":[{"kind":"SERVER_ENUM","ref":"Open-KO/KnightOnline@7d6cf81093e142c928c2ac9510512b2b182178b5:src/shared/globals.h"}],"confidence":"HIGH","notes":"Quest ID from OpenKO e_QuestId; NPC/event association is not asserted unless independently sourced."},{"id":15,"name":"Three Sacrificial Offerings","category":"QUEST","patch":"1298","source":[{"kind":"SERVER_ENUM","ref":"Open-KO/KnightOnline@7d6cf81093e142c928c2ac9510512b2b182178b5:src/shared/globals.h"}],"confidence":"HIGH","notes":"Quest ID from OpenKO e_QuestId; NPC/event association is not asserted unless independently sourced."},{"id":16,"name":"Zignon's Will","category":"QUEST","patch":"1298","source":[{"kind":"SERVER_ENUM","ref":"Open-KO/KnightOnline@7d6cf81093e142c928c2ac9510512b2b182178b5:src/shared/globals.h"}],"confidence":"HIGH","notes":"Quest ID from OpenKO e_QuestId; NPC/event association is not asserted unless independently sourced."},{"id":30,"name":"Worm Extermination","category":"QUEST","patch":"1298","source":[{"kind":"SERVER_ENUM","ref":"Open-KO/KnightOnline@7d6cf81093e142c928c2ac9510512b2b182178b5:src/shared/globals.h"}],"confidence":"HIGH","notes":"Quest ID from OpenKO e_QuestId; NPC/event association is not asserted unless independently sourced."},{"id":31,"name":"Gavolt Extermination","category":"QUEST","patch":"1298","source":[{"kind":"SERVER_ENUM","ref":"Open-KO/KnightOnline@7d6cf81093e142c928c2ac9510512b2b182178b5:src/shared/globals.h"}],"confidence":"HIGH","notes":"Quest ID from OpenKO e_QuestId; NPC/event association is not asserted unless independently sourced."},{"id":32,"name":"Collecting Silan Bones","category":"QUEST","patch":"1298","source":[{"kind":"SERVER_ENUM","ref":"Open-KO/KnightOnline@7d6cf81093e142c928c2ac9510512b2b182178b5:src/shared/globals.h"}],"confidence":"HIGH","notes":"Quest ID from OpenKO e_QuestId; NPC/event association is not asserted unless independently sourced."},{"id":33,"name":"Collecting Bulture Horns","category":"QUEST","patch":"1298","source":[{"kind":"SERVER_ENUM","ref":"Open-KO/KnightOnline@7d6cf81093e142c928c2ac9510512b2b182178b5:src/shared/globals.h"}],"confidence":"HIGH","notes":"Quest ID from OpenKO e_QuestId; NPC/event association is not asserted unless independently sourced."},{"id":34,"name":"Wolf Man Extermination","category":"QUEST","patch":"1298","source":[{"kind":"SERVER_ENUM","ref":"Open-KO/KnightOnline@7d6cf81093e142c928c2ac9510512b2b182178b5:src/shared/globals.h"}],"confidence":"HIGH","notes":"Quest ID from OpenKO e_QuestId; NPC/event association is not asserted unless independently sourced."},{"id":50,"name":"Beginner Quest","category":"QUEST","patch":"1298","source":[{"kind":"SERVER_ENUM","ref":"Open-KO/KnightOnline@7d6cf81093e142c928c2ac9510512b2b182178b5:src/shared/globals.h"}],"confidence":"HIGH","notes":"Quest ID from OpenKO e_QuestId; NPC/event association is not asserted unless independently sourced."},{"id":51,"name":"Warrior 70 Quest","category":"QUEST","patch":"1298","source":[{"kind":"SERVER_ENUM","ref":"Open-KO/KnightOnline@7d6cf81093e142c928c2ac9510512b2b182178b5:src/shared/globals.h"}],"confidence":"HIGH","notes":"Quest ID from OpenKO e_QuestId; NPC/event association is not asserted unless independently sourced."},{"id":52,"name":"Rogue 70 Quest","category":"QUEST","patch":"1298","source":[{"kind":"SERVER_ENUM","ref":"Open-KO/KnightOnline@7d6cf81093e142c928c2ac9510512b2b182178b5:src/shared/globals.h"}],"confidence":"HIGH","notes":"Quest ID from OpenKO e_QuestId; NPC/event association is not asserted unless independently sourced."},{"id":53,"name":"Magician 70 Quest","category":"QUEST","patch":"1298","source":[{"kind":"SERVER_ENUM","ref":"Open-KO/KnightOnline@7d6cf81093e142c928c2ac9510512b2b182178b5:src/shared/globals.h"}],"confidence":"HIGH","notes":"Quest ID from OpenKO e_QuestId; NPC/event association is not asserted unless independently sourced."},{"id":54,"name":"Priest 70 Quest","category":"QUEST","patch":"1298","source":[{"kind":"SERVER_ENUM","ref":"Open-KO/KnightOnline@7d6cf81093e142c928c2ac9510512b2b182178b5:src/shared/globals.h"}],"confidence":"HIGH","notes":"Quest ID from OpenKO e_QuestId; NPC/event association is not asserted unless independently sourced."},{"id":69,"name":"Invasion","category":"QUEST","patch":"1298","source":[{"kind":"SERVER_ENUM","ref":"Open-KO/KnightOnline@7d6cf81093e142c928c2ac9510512b2b182178b5:src/shared/globals.h"}],"confidence":"HIGH","notes":"Quest ID from OpenKO e_QuestId; NPC/event association is not asserted unless independently sourced."}]